{
  "version": "v0.1",
  "service_id": "thedivineparadox",
  "strategy_mode": "ritual-uiux",
  "roles": [
    {
      "role_id": "rebuild-intent-cell",
      "prompt_mode": "rebuild-intent-briefing",
      "allowed_prompt_scopes": [
        "archive-planning",
        "runtime-boundary-definition"
      ],
      "forbidden_prompt_patterns": [
        "runtime-code-generation-in-ai-governance",
        "trace-bypass",
        "approval-tier-waiver"
      ],
      "required_refs": [
        "services/thedivineparadox/contract.bundle.v0.1.json",
        "services/thedivineparadox/policy.profile.json"
      ]
    },
    {
      "role_id": "state-contract-cell",
      "prompt_mode": "deterministic-state-briefing",
      "allowed_prompt_scopes": [
        "api-contract-design",
        "state-derivation-design"
      ],
      "forbidden_prompt_patterns": [
        "free-form-user-input",
        "non-deterministic-verdicting",
        "raw-ip-logging"
      ],
      "required_refs": [
        "services/thedivineparadox/contract.bundle.v0.1.json",
        "services/thedivineparadox/agent-roles/uiux.execution-plan.v0.1.json"
      ]
    },
    {
      "role_id": "experience-systems-cell",
      "prompt_mode": "mobile-ritual-ux-briefing",
      "allowed_prompt_scopes": [
        "mobile-first-layout",
        "visual-budget-guardrails"
      ],
      "forbidden_prompt_patterns": [
        "unbounded-asset-expansion",
        "desktop-first-layout",
        "performance-budget-ignore"
      ],
      "required_refs": [
        "services/thedivineparadox/contract.bundle.v0.1.json",
        "services/thedivineparadox/agent-roles/uiux.execution-plan.v0.1.json"
      ]
    },
    {
      "role_id": "runtime-safety-cell",
      "prompt_mode": "oracle-safety-briefing",
      "allowed_prompt_scopes": [
        "safe-fallback-design",
        "rate-limit-and-cache-review"
      ],
      "forbidden_prompt_patterns": [
        "unbounded-generation",
        "schema-skip",
        "moderation-skip"
      ],
      "required_refs": [
        "services/thedivineparadox/policy.profile.json",
        "policies/approval_tier_policy.v0.1.json"
      ]
    },
    {
      "role_id": "release-gate-cell",
      "prompt_mode": "release-evidence-briefing",
      "allowed_prompt_scopes": [
        "release-verdict",
        "rollback-readiness"
      ],
      "forbidden_prompt_patterns": [
        "merge-without-validation",
        "archive-omission",
        "evidence-free-release"
      ],
      "required_refs": [
        "services/thedivineparadox/agent-roles/uiux.execution-plan.v0.1.json",
        "services/thedivineparadox/policy.profile.json"
      ]
    }
  ],
  "global_guardrails": [
    "Prompt execution must preserve deterministic evidence references.",
    "Prompt execution must keep runtime implementation out of ai-governance.",
    "Prompt execution must treat the dedicated runtime repo as the only place for product code."
  ]
}
